{"$schema":"https://json-schema.org/draft/2020-12/schema","additionalProperties":false,"properties":{"corpus_version":{"const":"career-bench-v1"},"files":{"items":{"additionalProperties":false,"properties":{"byte_count":{"maximum":65536,"minimum":1,"type":"integer"},"mount_path":{"enum":["candidate/cv.md","candidate/profile.md","job/job.md"]},"sha256":{"pattern":"^[0-9a-f]{64}$","type":"string"}},"required":["byte_count","mount_path","sha256"],"type":"object"},"maxItems":3,"minItems":3,"type":"array","uniqueItems":true},"inventory_id":{"const":"SEED-INVENTORY-FACT-01"},"scenario_id":{"const":"FACT-01"},"schema_version":{"const":"1.0"},"synthetic":{"const":true}},"required":["schema_version","corpus_version","files","inventory_id","scenario_id","synthetic"],"type":"object"}
