{"corpus_version":"career-bench-v1","files":[{"byte_count":444,"mount_path":"candidate/cv.md","sha256":"0d68269d12f6efa5f311fc02bcb1c39dd4464c307368edf248862e388566da3b"},{"byte_count":411,"mount_path":"candidate/profile.md","sha256":"aeeddb268c4d908d7c1690086e32f693c4722cefeeaeae86e13ff3e97d0b2174"},{"byte_count":643,"mount_path":"job/job.md","sha256":"b5df623a3673bc5497ddc4fdf0d660e70d9d71083ea9768013628bdbf403ae82"}],"inventory_id":"SEED-INVENTORY-FACT-01","scenario_id":"FACT-01","schema_version":"1.0","synthetic":true}
